project_name,project_sector
Construction of New Schools For Agile at All the 34 LGAs,Infrastructure
"Construction of Aviation Fuel Handling Terminal (100,000Ltrs) at Umar Musa Yaradua Airport ",Infrastructure
"Gulf of Guinea Gas Pipeline Project, Bonny (Nigeria) - Punta Europa ( Equatorial Guinea)",Oil & Gas
"Granite Rock Quarrying Project (26198QLS) at Gbaupe Village, Abuja Municipal Area Council (AMAC)",Mining
"Gold Ore Exploration and Mining at Kemtu Village, Fakai LGA",Mining
"Mica, Beryl, Lithium and Quartz Mining (27354SSML) Obi LGA",Mining
"MM Port FZE, Onne, Eleme LGA",Infrastructure
"Baryte, Lead, Zinc and Copper  Mining Operation (22979SSML) in Obubra LGA                                                                      ",Mining
"I.A port  FZE at Onne, Eleme LGA",Infrastructure
"Construction of Fertilizer Blending Plant at Ashaka Close, Bauchi Industrial Area, Bauchi",Manufacturing
"Solar Photovoltaic Power Plant at Tobacco Road, Ibadan, Oluyole LGA",Infrastructure
"Kunzite, Tantalite, Beryllium and Tin Mining at Bakin Kogi and  Kanikon Chiefdom Communities,  Jema'a LGA",Mining
"Project steering committee (PSC) on the Development of the 1,650 MW Makurdi Hydropower Dam Project",Others
"Container Terminal Development at Giorgio Town, Tedi Community, Ojo LGA",Infrastructure
"Nigeria for Women Program Scale-Up in Akwa-Ibom, Abia, Kebbi, Niger, Ogun, Taraba and 14 other States",Agriculture
"Moor Eggs from Moor Farms at Anaku town, Ayamelum LGA ",Agriculture
Two (2) Mini-Grid Projects at Kubau LGA,Renewable Energy
"ESMP FOR THE THREE (3) MINI-GRID PROJECT SITES AT IJEBU EAST LOCAL GOVERNMENT AREA, OGUN STATE, BY LAPOMIK ENERGY NIGERIA LIMITED",Renewable Energy
"Dualization of Akwanga - Jos - Bauchi - Gombe Road in Nasarawa, Plateau, Bauchi and Gombe States",Infrastructure
"TGI Distri Culinary Mix Facility at Flowergate Industrial Scheme, Shagamu",Manufacturing
"Proposed 18MW Captive Power Plant Project Located Within the HoneyWell Export Processing Zone in Flower Gate Industrial Scheme Estate, Sagamu LGA",Power
Construction of New Schools for Agile Project Katsina,Infrastructure
"Construction of a 90 tons/hr Fertilizer Blending Plant Located at No 1, Ashaka Close, Bauchi Industrial Area, Bauchi",Infrastructure
"Lithium Mineral Mining Project Within the Exploration License No. 36477EL, Onda Village, Udege Development Area, Nasarawa LGA",Mining
Q1-4 Sidetrack/Well Re-Entry at QUA IBO Field OML-13,Oil & Gas
,
"Rehabilitation of Jos and Bukuru Metropolitan Water Supply Project in Jos-North, Jos-South, Jos-East, and Bassa and Barkin-Ladi LGAs",Infrastructure
"High Voltage Distribution Network (HVDN) from Alaoji, Abia State to Amichi Anambra State though Owerri, Imo State",Power
"Framework for Integration of Utility-Scale Solar Power into the Nigeria Grid and Resolution of Impasse with Developers for 1,000MW of On Grid Solar Plants",Others
"Gas Compression and Liquefaction Facility at Ore Industrial Park, Odigbo LGA",Oil & Gas
ATC Nigeria Phase 21 BTS (223 BTS in 18 States and the FCT),Telecommunications
Installation of 20MT/day Thermal Desorption Unit (TDU) in Afor Ogbedigbo off Kwale Ogwashikwu Express in Ndokwa East LGA,Waste Management
Fashola Agribusiness Industrial Hub (FAIH) at Oyo West LGA,Agriculture
"Solar Mini Grid Development at Araromi Oke-Odo, Mefoworade, Onigbodogi, Omifunfun, Orisunbare and Apoje Communities, Ife South LGA",Renewable Energy
Four (4)  Solar Hybrid Mini-Grid Project,Renewable Energy
"Gold Exploration (30263EL) at Gidan Sanni Village, Moro LGA",Mining
LPG Extraction from Utorogu Gas Plant in Ughelli North LGA,Oil & Gas
Development of Solar Mini-Gird in Eleven (11) Communities in Baruten LGA,Renewable Energy
"Solar Mini-Grid in Borgu, Magama, Agwara and Rijau LGAs",Renewable Energy
"Permanent  Site of the Federal College of Education Iwo, Iwo LGA",Infrastructure
Granite Quarry Project(26139QL) at Tsakuwa Village Dawakin Kudu LGA,Mining
Sand Quarry Project(26140QL) at Tsakuwa Village Dawakin Kudu LGA,Mining
"Privida  Mini Grid Projects in Abocho-Ojogba, Echeu, Emewe Efopa, Ochi Districts, Ofa, Ogene Ago, Ojamapunu, Oji Ofa, Ojo Agefu, Okura Ofante and Oyakoji Communities ",Renewable Energy
" Solar Mini Grid power  998.6kwp at Ibaka Community,Mbo LGA",Renewable Energy
" Solar Mini Grid power  278.4KWp at Effraya Community, Etung LGA",Renewable Energy
"45M Dangote Cement Transport Masts at Dangote Transport Administrative Complex & PTI, Obajana",Infrastructure
"100MW Power Generation in Lagos Free Trade Zone, Ibeju Lakki LGA ",Power
Greater Onitsha Water Supply Scheme in Onitsha North LGA,Infrastructure
Manufacturing of Soyabean Crude Oil and Meal in Obafemi Owode LGA,Manufacturing
Lead/Zinc Mining (32031SSML) at Wong Community Alkaleri LGA,Mining
Lead/Zinc Mining (36200SSML) at Wong Community Alkaleri LGA,Mining
Lead/Zinc Mining (29075SSML) at Wong Community Alkaleri LGA,Mining
"Development of Solar Mini-Grids in Six (6) Communities Ayila, Jewo, Aba-Oyo, Agboro, Onipetesi and Iyaniwura ",Renewable Energy
Development of Solar Mini-Grids in Bwari and Gwagwalada LGAs,Renewable Energy
"Development of Solar Mini-Grids in Bodinga, Dange Shuni, Goronyo, Gwadabawa, Illela and Kware LGAs",Renewable Energy
"Development of Solar Mini-Grids Across Ten (10) Communities in Argungu, Birnin-Kebbi, Bunza, Augie, Maiyama and Gwandu LGAs",Renewable Energy
"Development of Solar Mini-Grids Across Seventeen (17) Communities in Kware, Shagari, Sokoto North and Sokoto South LGAs",Renewable Energy
"Development of Solar Mini-Grids Across Ten (10) Communities in Jega, Koko-Besse, Maiyama, Yauri and Zuru LGAs",Renewable Energy
"Development of Solar Mini-Grids Across Seventeen (17) Communities in Dambam, Darazo, Dass, Ganjuwa, Itas-Gadau, Katagum, Kirfi, Misau, Ningi, Shira, Tafawa-Balawa, Toro and Warji LGAs",Renewable Energy
"Development of Solar Mini-Grids Across Seventeen (17) Communities in Bauchi, Toro and Alkaleri LGAs",Renewable Energy
"Development of Solar Mini-Grids Across Sixteen (16) Communities in Sokoto South, Tambuwal, Tureta, Wamakko and Wurno LGAs",Renewable Energy
Development of Solar Mini-Grids Across Fifteen (15) Communities in AMAC and Gwagwalada LGAs,Renewable Energy
"Development of Solar Mini-Grids Across Sixteen (16) Communities in Kuje, Kwali and Abaji LGAs",Renewable Energy
"Development of Solar Mini-Grids Across Ten (10) Communities in Odigbo, Ondo East,  Ilaje, Ese-Odo and Irele LGAs",Renewable Energy
 River Suntai Hydro Power Generation in Bali LGA  ,Infrastructure
"Dolomite, Limestone and Marble Mining (28167SSML) in Sabo-Ogbe Village, Akoko Edo LGA",Mining
Limestone Exploration (30978EL) in Egbado North LGA,Mining
Chloe Baby and Hygienic Greenfield Manufacturing Plant Project in Ezeagu LGA,Manufacturing
Construction of 25 BTS Sites in 8 States and the FCT (Phase 4),Telecommunications
24 inch X 15Km Natural Gas Transmission Pipeline from Ibafo Valve Station to Lagos Industrial Area (LIA) City Gate.,Oil & Gas
"Construction of National Drug Law Enforcement Agency (NDLEA)  Barracks in Gwaska Community, off Umaru Yar'Adua Way Abuja.",Infrastructure
"Construction of National Drug Law Enforcement Agency (NDLEA)  Barracks at Itoga Community along Lagos-Badagry Expressway, Opposite Mobil Filling Station and Princess Paints in Badagry LGA.",Infrastructure
"Construction of National Drug Law Enforcement Agency (NDLEA)  Barracks in Gombe-Yola Highway at Kwanan Waya,  Namtari Community, Yola, Yola North LGA ",Infrastructure
"Tin, Columbite, Tantalite, Gold and Marble Mining (29697SSML) at AMAC Abuja",Mining
Aircraft Hanger Terminal at Murtala Muhammed International Airport,Infrastructure
National Guidelines on Resettlement Action Plan (RAP),Others
"Primavera Chemical Factory Complex in Oke Aro, Ifo LGA",Manufacturing
Construction of 39000tons Storage Capacity of LPG Marine Terminal at Onne Port Complex,Infrastructure
"Lithium Mineral Exploration (40426EL) at Endo Village, Nasarawa LGA ",Mining
Development of Solar Hybrid Mini Grid in Ajebambo Community(Ondo West LGA) and Ago Daada (Akure North LGA),Renewable Energy
"Aviation Fuel Deport Plot Cp 94, Sector Centre B Layout, Kuje LGA",Infrastructure
"Bulk Petroleum Storage Deport in Abiakowo Ebughu, Mbo LGA",Oil & Gas
"Solar Mini-Grids in (Adamu Agyo, Arugbadu Gida and Kampani) Lafia East, (Bakyano) Nasarawa Eggon  and  (Amaku) Doma LGAs",Renewable Energy
"Scope Expansion of 150,000 to 200,000 BPD BUA Refinery and Petrochemical Project at Ntaikank, Ibeno LGA",Oil & Gas
Construction of Africa Centre of Excellence for Sustainable Power and Energy Development (ACE-SPED) Services Core Building and Hostel Renovation,Infrastructure
"Ogun State Special Industrial Zone (Phase 1A,B and C) in Ikenne and Remo North LGAs",Infrastructure
"Ogun State Special Industrial Zone (SIZ) in Ikenne, Shagamu and Remo North LGAs ",Infrastructure
National Facilitation Committee on Road Transport and Transit (NFCRTT) Ecowas,Others
Solar Mini Grid Development in  (Imane  Community) Olamaboro LGA (Unweli and Uname  Communities) Ibaji LGA (Alla Ejima  Community) Ofu LGA (Icheke  Community) Omala LGA ( Odagba  Communities) Ankpa LGAand ( Agojeju and Onyakoji  Communities) Dekina LGA,Renewable Energy
"Solar Mini Grid Development in  (Imoru, Ijagba and Ute  Communities) Ose LGA (Idi Iroko Community) Ile Oluji/Oke Igbo LGA (Igbekebo and Agadagba  Communities) Ese Odo LGA (Ala Ajagbusu  Community) Akure North LGA and (Bolorunduro Community) Ondo East LGA",Renewable Energy
 Construction of Aviation Fuel Storage Depot at Nnamdi Azikiwe International Airport,Infrastructure
Glass Factory Project,Manufacturing
Assa North Ohaji South (ANOH) Gas Plant Project,Oil & Gas
"Construction and Operations of Abat Truck Park at Orile-Iganmu, Surulere LGA",Infrastructure
Rehabilitation of The 4000HA Adani Irrigation Facility at Uzo-Uwani LGA.,Infrastructure
"Solar Mini Grid Across15 Communities in  Buji, Birnin Kudu and Ringim LGAs",Renewable Energy
" Construction of Africa Centre of Excellence on Technology Enhanced Learning at National Open University, Jabi, Abuja Municipal Area Council (AMAC) ",Infrastructure
"Development of Port Facility at Oil and Gas Free Zone, Federal Ocean Terminal, Onne Port Complex, Eleme LGA",Infrastructure
Rural Access and Agricultural Marketing Project (RAAMP),Others
Sub Committee on Sustainable Blue Economy in Nigeria,Others
Steering Committee on Rehabilitation and Reconstruction of Port Harcourt - Maiduguri Eastern Narrow Guage Rail Way with New Branch Lines and Transshipment Facility,Infrastructure
Oloye Marginal Field Development Plan (PPL 245) in Warri North LGA,Oil & Gas
"Uduwa Lithium & Gemstone Mining Processing Plant at Uduwa, Chikun LGA",Mining
Development of 100kwp Solar Mini - Grid each at Abbare & Mayo - Lope Communities in Lau LGA,Renewable Energy
"Mining & Processing of Cassiterite, Columbite, Aquamarine, Topas, Zircon at Tafawa-balewa LGA",Mining
"CNG Downloading and Storage for Power Generation at Isolo Industrial Estate, Oshodi Isolo LGA",Oil & Gas
Full Scope Development of Arterial Road N16 from Ring Road II (RRII) to Ring Road III (RRIII) with 2NO Interchange Structures at the N16/RRII& N16/RRIII Interchanges at AMAC,Infrastructure
"Shoreline Protection of Amassoma Shores Design and Construction of Section 1,2 & 3 Amassoma in Southern Ijaw LGA",Infrastructure
"Construction of Otuogari-Otuegwe Bridge Across Ekole Creek, Ogbai LGA",Infrastructure
Construction of 10km Ayama-Ebeni-Akeddei-Ogboinbiri Road in Southern Ijaw LGA,Infrastructure
Construction of Aifuwa Street Upper Sokponba Road (Phase 1) Ikpoba-Okha LGA,Infrastructure
Construction of Usugbenu Internal Road (Lot 1-3) in Edo Central Senatorial District,Infrastructure
Dualization of Sanubi-Orogun Road Phase 1 (Lot 1-8) in Ugheli North LGA,Infrastructure
Construction of Mother and Child Hospital(Lots 1-3) in Orlu LGA,Infrastructure
Construction of 8km Umuagwo Old Road through Police to Umukenne Phase 1 (Lot 1-3) Ohaji/Egbema LGA,Infrastructure
"Construction of 6km Mgbachi, Uzinaumu, Umuabiahu, Ihitte, Otulu, Umuhu-Umuezem Road with Spur (Lot 1-3) Oguta LGA",Infrastructure
"Construction of Concrete Roads at Opume and Ibelebiri Communities, Ogbia LGA",Infrastructure
"Construction of 7km Aleibiri, Tuomo, Ayamasa Concrete Road (Lot 1-2) Ekeremor LGA",Infrastructure
"Mining of Amethyst, Beryl and Tourmaline (25647 SSML) in Ifelodun LGA",Mining
Development of 100Kwp Solar Mini-Grid each at Akum and Udenin-Gida Communities in Nasarawa LGA,Renewable Energy
Development of 100Kwp Solar Mini-Grid each at Abbare and Mayo-Lope Communities in Lau LGA,Renewable Energy
Exportation of Snails and Periwinkles at Parkview Estate Okota Oshodi-Isolo LGA,Agriculture
Sand Mining Project in Obafemi Owode LGA,Mining
"Solar Mini-Grid Project at Ewohimi, Olinlin, Uroh, Ebulen, Ebun and Ewoiki Communitiesin Esan South-East and Esan North-East LGAs",Renewable Energy
"Construction of a Barge Jetty and Stacking Facilities at Imota-Agbowa, Epe LGA",Infrastructure
"Fifteen (15) Solar Mini-Grid Project in Shadam, Langtang South, Bokkos and Wase LGAs",Renewable Energy
"65km 330kV DC Transmission Line for the Knipp Project in Rano, Bebeji, Garun Mallam, Kura, Madobi, Kumbotso, Tofa and Ungongo LGAs",Power
"Construction of National Control Centre in Dukpa, Gwagwalada Area Council",Infrastructure
"Installation of 60 Tons per hour Palm Oil Mill at Ore, Odigbo LGA",Infrastructure
Exploration for Coal (31469EL)  at Oshimili North LGA,Mining
Lithium / Nobium Ore (39368 SSML) at Karu LGA,Mining
"Development of 100,000 Metric Tonnes Soya Beans and Rice Bran Oil Mill at Danzaki Village, Hadejia Road, Gezawa LGA",Infrastructure
Construction of Filling Station at Kuje Area Council,Infrastructure
"Construction of New Schools, Seventy Five (75) J.SS with three blocks and fifty (55) SSS with four blocks across 44 LGA's ",Infrastructure
"100 Tonnes Paddy Rice/60 Tonnes ParBoiled Rice Mill at Danzaki Village, Hadejia Road, Gezawa LGA",Agriculture
"Production of Four (4) Megawatts Power from Rice Husk and Natural Gas for Internal Consumption at Danzaki Village, Hadejia Road, Gezawa LGA",Agriculture
"Construction of Mother/Child hospital, at Orlu LGA",Infrastructure
"Construction of 6km Mgbachi, Uzinanumu, Umuabiahu, Ihitte, Otulu, Umuhu-Umuezem road, with Spur (Lot 1-3), Oguta",Infrastructure
"Construction of the African Center of Excellence for Drug Research, Herbal Medicine Development and Regulatory Science (ACEDHARS) building at Lagos mainland LGA ",Infrastructure
"Solar Hybrid Mini-Grid Pipeline at Odigbo, Ondo West, Akure North, Ile Oluji/Okeigbo & Ose LGA",Renewable Energy
Solar Hybrid Mini-Grid Pipeline at Ovia South west LGA,Renewable Energy
Construction of Compressed Natural Gas (CNG) Facility and Cylinder Manufacturing Project at  Iwhrekan Ugheli North LGA,Oil & Gas
Liquefied Petroleum Gas (LPG) Bottling and Refilling Plant at Plot 937 Cadastral Zone C16 Idu Industrial Area 1 Abuja,Oil & Gas
"Liquefied Petroleum Gas (LPG) Bottling and Refilling Plant opposite International Conference Center, Bauchi-Gombe Road, Akko LGA",Oil & Gas
Iron Ore Exploration  (26646EL)  in Lokoja LGA,Mining
"Construction of Transit Trailer Parks at Aviele, Etsako West and Ahor, Uhunmwonde LGA's",Infrastructure
Construction of Iru-Egbede Roads Network-Abudu with Drainage at Phase 2 (Lots 1&2) Orhionwhon LGA,Infrastructure
Mining of Lithium and Nobium Ore (39515SSML) in Karu LGA,Mining
"Construction of Evboeghighae-Idunmwunlaka-Otobaiye Road (Phase 1), Orhionwhon LGA",Infrastructure
"Construction of Egbokor-Evbodobian-Adibuohien-Evbuokabua (Phase 1), Orhionwhon LGA",Infrastructure
Exploration of Cassiterite and lithium Ore (39034 EL) in Kuje LGA,Mining
Exploration for Iron-Ore (31698EL) at Okofi LGA,Mining
"BUA Cargo Port in Ntaikang, Ibeno LGA",Infrastructure
Exploration for Iron-Ore (31699EL) at Lokoja-Agbaja LGA,Mining
" Construction of Food Processing Facility at Onicha-Ugbu, Anochia North LGA",Infrastructure
Construction of 4km Agbo Okela to Oscars  Ikare Akoko (Lot 1-3),Infrastructure
"Construction of 2km Oke Igbagbo to Oke Imole Road, Auga Akoko (Lots 1&2)",Infrastructure
Construction and Equipping of Modern Hospital in Okeagbe Akoko (Lot1-2),Infrastructure
Exploration of Iron Ore (31697EL) in Lokoja LGA,Mining
Hybrid Solar Mini Grid in Two Communities  Kalong ( Shendam LGA) and Mararaban Demshin (Quan pan LGA),Renewable Energy
Small Scale Mining/Mining Lease of Lithium Ore (42150SSML) at Nasarawa LGA,Mining
Construction of Ahoada-Omuku Road at Ahoada West LGA,Infrastructure
Construction of Rural Telephony Base Transceiver Stations (Phase 4) 11 BTS Sites across 10  States ,Telecommunications
Sapele North Field Development  in Sapele West LGA,Oil & Gas
Sapele South Field Development  in Sapele LGA,Oil & Gas
Mosogar Field Development in Ethiope west LGA,Oil & Gas
"Ubaleme Field Development, Ohahi/Egbema LGA ",Oil & Gas
50KWp Solar Mini-Grid Power Ndiata Aunomous Community in Obingwa LGA,Renewable Energy
100KWp Isolated Solar Mini-Grid at Item-Amagu Community in Ikwo LGA,Renewable Energy
ATC Nigeria Phase 22 BTS (199 BTS in 21 States and the FCT),Telecommunications
"Power Plant Expansion from 12MW to 50MW in Lekki Free Trade Zone, Ibeju-Lekki, Epe LGA",Power
"Afe Babalola University Free Trade Zone, Ado LGA ",Infrastructure
Wet Gas Processing Plant at Ugheli South LGA,Oil & Gas
"Construction of Food Processing Company at Km 48, Idi Ayunre, Oluyole LGA ",Manufacturing
20 Million Metric tonnes per annum Agro-Allied Chemical Production Facility at Obafemi-Owode LGA,Manufacturing
"AS Energy Pipe Manufacturing Plant in Polaku, Yenagoa LGA",Manufacturing
United Nations Harmony with Nature,Others
"100,000 Barrels per day Modular Refinery in Koko, Warri North LGA ",Oil & Gas
"Kuri Field Development at Warri-North LGA,  ",Oil & Gas
" Perimeter Fencing of 209 Hectares of Land at Aleto, Eleme LGA",Infrastructure
Concession of the Development of 136MW Manya and 182MW Bawarku Hydropower Dam Projects under Public Private Partnership (PPP) Arrangement ,Others
Construction of 155 Schools Across 23 LGAs,Infrastructure
Rehabilitation of 550 Schools Under the Kaduna State AGILE Project ,Infrastructure
"Construction of 20,000 tonnes/year Lubricant Oil Blending Plant in Naibawa Community, Kumbotso LGA",Infrastructure
"Construction of Storage Tank Farm and Formaldehyde Production Factory in Koko Community, Warri North LGA",Infrastructure
"Construction of Compressed Natural Gas (CNG) Plant in Km9 Ibadan-Lagos Expressway, Oba Otudeko Avenue, Olyole LGA, Ibadan",Oil & Gas
Construction of Africa Centre of Excellence on New Pedagogies in Engineering Education (ACENPEE),Infrastructure
OML 118 Bonga Main 4D and Bonga North 3D Ocean Bottom Node (OBN) Seismic Data Acquisition in Deep Offshore ,Oil & Gas
"Construction of 3.65 Km Concrete Road at Umueme Road, Obingwa LGA",Infrastructure
"Dangote Cement plc Obajana Plant Telecom tower at Dangote Cement Obajana Plant Premisis, Lokoja lga",Infrastructure
EIA General: Petrol Filling Stations and Related Projects,Others
3D High Resolution Seismic Data Acquisition Over Adagbasa Project in OML 40 at Warri North Lga,Others
Cumulative Impact Assessment of Lekki Free Trade Zone (LFTZ)  at Ibeju Lekki ,Others
Circular Economy,Others
"Expansion of Century Industrial FZE Factory at Ogun-Guangdong Free Trade Zone (OGFTZ), Igbese, Ado-Odo/Otta Lga",Manufacturing
"Provision of 172kw Mini-Grid Project at Ojeh Community, Dekina Lga; Nep-Performance Based Grant. (Agojeju, Agbada & Ojeh)",Renewable Energy
Tin Ore Exploration and Mining at Shaki East Lga,Mining
"Construction of Ferry Terminals Jetties Shipyard for Vessel Maintenance and Channelization  of Water Routes at Westline (Ebute Ojo-Ebute Ero); Mainland Central Line (Festac-Marina); North Eko District Line (Ikorodu-cms, Marina); North Island Line (Ikorodu-Falomo); Eastline (Badore-Falomo) & North Central Line ",Infrastructure
"Solar Mini-Grid Development in Sabongeri and Kungurki Communities, 
Kaura Namoda LGA",Renewable Energy
"Reconstruction/dualization of the Emohua-Abalama/Tema Junction road in Emohua/Asari-Toru, LGAs and the Extension of Dualization of Ahoada -Omuku Road from Ogbo-Ukodu Road Junction in Ahoada-East and Ogba-Egbema-Ndoni LGAs",Infrastructure
"Construction of Centre of Excellence for Environmental Remediation (CoEER) in Wiiyakara Community, Khana LGA",Oil & Gas
"Solar Hybrid Mini-Grid  project in Ten (10) Sites at Onikoko, Ajambata, Oluke Orile, Oluke Tunutun, Ipaso, Obanlado, Aiyesan, Iwopin, Agbure and Lomiro Communities in Ewekoko and Waterside LGAs ",Renewable Energy
"Solar Hybrid Mini-Grid at Agaliga, Enelie, Ikanekpo and Uferane in Olamaboro and Ankpa LGAs",Renewable Energy
"Solar Hybrid Mini-Grid Project at Zipline Site in Ndok Community, Ogoja LGA",Renewable Energy
Gold Ore Exploration and Mining at Atakunmosa Lga,Mining
" Construction of Poultry Processing Plant (Abattoir) at Ile Ogbo, Ayedire LGA",Infrastructure
Coal Exploration and Mining at Ankpa Lga,Mining
Development of Gas Downstream Project at Eastern Obolo LGA,Oil & Gas
Recreational Hub Development at 52 Kofo Abayomi Street Victoria Island Etiosa Lga,Infrastructure
Construction of Fertilizer Plant in Eastern Obolo LGA,Infrastructure
"Construction, Installation and Operation of deep water port at Eastern Obolo Lga ",Infrastructure
"Construction, Installation and Operation of Gas Processing Plant at Eastern Obolo Lga",Infrastructure
Construction of Polymer Plant in Eastern Obolo LGA,Infrastructure
"100MW Power Distribution project at Lagos Free Zone, Ibeju Lekki LGA",Power
Petrochemical Plant Project at Eastern Obolo LGA,Oil & Gas
Capacity Building on Environmental and Social (E&S) Management for Companies in Nigeria,Others
Silica Sand and Iron Ore Quarry Project (26974QL) at Ogurube Village Ebonyi LGA,Mining
"Lead and Zinc Exploration at Bunga-Didinma Village, Bauchi LGA",Mining
Gold Exploration (31622EL) Project at Shasha Village Ife South LGA ,Mining
Gold Exploration  (31623EL) Project in Okeigbo Village Ife South LGA ,Mining
Gold Exploration (31624EL) in Omisore Village Ife South LGA,Mining
"Construction, Installation and Operation of Liquefied Natural Gas Plant in Eastern Obolo LGA",Oil & Gas
"Malatex 100MW Gas-Fire Combined Cycle Power Plant and Associated infrastructures at Ikot Abasi, Oruk Anam, Ukanafun, Etim Ekpo, Essien Udim and Ikot Ekpene LGAs",Power
"Construction of Battery Manufacturing Plant, Cable Manufacturing Plant and Battery Recycling Plant in Makun Shagamu, Shagamu LGA",Manufacturing
BUA Cement Quarry in Ibese,Mining
Construction of  BUA Cement Plant in Ibese ,Infrastructure
"Provision of Screens along the River Routes at Mpape End of Lower Usuma Dam, Bwari Area Council",Infrastructure
"Construction of 990KW Interconnected Solar Mini-Grid in Lambata, Gurara LGA,",Renewable Energy
"Dredging of San Barth Break Waters, in Akuku Toru LGA",Mining
Gas Pipeline Downstream Gas and Petrochemical in Eastern Obolo LGA,Oil & Gas
"Upgrade of Pesticide Formulation and Repackaging Factory in Ogondele Village, Alomaja, Oluyole LGA",Infrastructure
"Feldspar Stone Quarry at Apata Iyanrun, Near Oosa Village, Ikire Irewole LGA",Mining
"Lead, Zinc and Barite Mining and Processing (29701SSML) in Gabu Community, Yala LGA",Mining
"Kaolin Exploration (31335EL) in Beni Village, Kirfi LGA",Mining
"Copper Exploration (30863EL) in Ungwan Jalatu Village, Kafur LGA",Mining
"Copper Exploration (31225EL) in Maidanga Village, Kebbe LGA",Mining
"Lead and Zinc Exploration (27009EL) in Sabon-Gida Village, Wase LGA",Mining
"300 KWP Solar PV - Diesel Hybrid Project in Institute of Human Virology, Nigeria (IHVN) at Abuja Municipal Area Council",Power
327 KWP Solar PV - Diesel Hybrid at SCL Farms Kwali,Power
"597 KWP Solar Pv - Diesel Hybrid at Valentine Chicken Limited, Ilorin",Power
"112 KWP Solar PV - BESS at Feccox Pharmaceuticals Limited, Ungogo LGA",Power
"410 KWP Solar PV - Diesel Hybrid at Champion Breweries Plc, Uyo",Power
"Librod Solvents and Lube Tank Farm at Ladol Free Zone, Apapa LGA",Infrastructure
"Zircon, Tantalite, Lithium Ore Exploration and Mining (30852 EL) at Ushongo LGA",Mining
  Construction of Rural Telephony Base Transceiver Stations (Phase 5) 25 BTS Sites across 17  States ,Telecommunications
"77MW Combined Cycle Power Plant at Railway Compound Ebute Metta, Lagos Mainland LGA",Power
"Construction of Ibi-Bridge Across River Benue Along Wukari-Ibi-Shendam Road in Ibi Town, Ibi LGA",Infrastructure
"Construction of Industrial Palm Oil Mill , 80 Tons FFB per Hour Palm Oil Mill and 180 Tons per Day Palm Kernel Crushing Plant in Orhionmwon LGA",Agriculture
"Exploration of Barite, Copper, Lead, Zinc and Gold(31541EL) in Keana LGA",Mining
"Exploration of Barite, Copper, Lead, Zinc and Gold (31542EL) in Keana LGA",Mining
Emeabiam Field (OML 53) Development Project in Ohaji/Egbema LGA ,Oil & Gas
Aku Field (OML 53) Development Project in Okigwe LGA,Oil & Gas
 Construction of Aluminium Smelter Plant in Eastern Obolo LGA,Infrastructure
"Expansion of Ilera Agro Processing Plant in Challawa Industrial Estate, Kumbotso LGA",Agriculture
Correspondence with Ministry of Water Resources,Others
Construction of 3.2km Access Road ,Infrastructure
"Construction and Installation of Solar Power Hybrid Mini-Grid in Dambatta, Dawakin Tofa and Bichi LGA",Renewable Energy
Adolescent Girls Initiative for Learning Empowerment in 16 LGAs ,Infrastructure
Tin/Columbite Ore (31498EL) Exploration and Mining at Mangu LGA ,Mining
"Solar Hybrid Mini-Grid at Ise Community in Ibeju, Lekki LGA",Renewable Energy
Expansion at Kiara Rice Milling Plant from 400MTD to 1000MTD at Kpatsuwa Village in Mokwa LGA,Infrastructure
